source,Headline
Al Jazeera English,Libya militias rake in millions in European migration funds: AP
Al Jazeera English,"2020: World rings in new year amid wildfires, protests"
Al Jazeera English,Former Renault-Nissan boss Ghosn confirms he has left Japan
Al Jazeera English,India's top court orders review of Kashmir internet shutdown
Al Jazeera English,US House votes to restrain Trump's actions against Iran
Al Jazeera English,US-Iran tensions after Soleimani killing: All the latest updates
Al Jazeera English,Pelosi says she will submit Trump impeachment to Senate
Al Jazeera English,"Bomb attack targets worshipers at Quetta mosque, killing 14"
Al Jazeera English,Zelenskyy: Claims Iran missile downed Ukraine plane 'unconfirmed'
Al Jazeera English,US rejects Iraq request to discuss troop withdrawal
Al Jazeera English,'Keep your war away': Iraqis revive protests amid US-Iran tension
Al Jazeera English,Haitham bin Tariq 'named successor' to Oman's Sultan Qaboos
Al Jazeera English,Oman's Sultan Qaboos dies: state media
Al Jazeera English,Tsai Ing-wen takes lead in Taiwan's presidential election
Al Jazeera English,"Qassem Soleimani killing sparks concerns, deepens divide in Iraq"
Al Jazeera English,'Loss for region': World reacts to death of Oman's Sultan Qaboos
Al Jazeera English,Iraq PM tells Kurdish leaders he does not seek hostility with US
Al Jazeera English,'Go back Modi': India protesters condemn PM's visit to Kolkata
Al Jazeera English,Merkel: Germany to host Libya peace conference
Al Jazeera English,Iraq: Anti-government protesters denounce pro-Iran crowds
Al Jazeera English,"Greece, Israel, Cyprus, move to build East Med gas pipeline"
Al Jazeera English,Kuwaiti makeup artist slammed for posting blackface photo
Al Jazeera English,Iraq: Katyusha rockets fired at Baghdad airport
Al Jazeera English,"Rockets target Baghdad's Green Zone, base housing US troops"
Al Jazeera English,'You never let us down': Thousands mourn Soleimani in Baghdad
Al Jazeera English,World reacts to US killing of Iran's Qassem Soleimani in Iraq
Al Jazeera English,No deal: Libya's parliament votes against Turkish involvement
Al Jazeera English,Dozens killed in attack on military academy in Libya's Tripoli
Al Jazeera English,Al-Shabab attacks military base in Kenya's Lamu county
Al Jazeera English,'A shape in the ash': Bushfires destroy Australian wildlife
Al Jazeera English,Trump: 52 sites to be targeted if Iran retaliates over Soleimani
Al Jazeera English,Soleimani killing: Iran abandons nuclear deal limits
Al Jazeera English,"New Delhi: Students, teachers injured in clashes at JNU"
Al Jazeera English,Rockets target Baghdad's Green Zone for second successive night
Al Jazeera English,New US air raid targets Hashd commander in Iraq: state TV
Al Jazeera English,"3,000 additional US troops heading to Middle East: Officials"
Al Jazeera English,In Pictures: Thousands march in Baghdad to mourn Soleimani
Al Jazeera English,Afghanistan fears violence in region after Soleimani's killing
Al Jazeera English,Trump's assassination of Soleimani: Five things to know
Al Jazeera English,Rockets hit Iraq military base hosting US troops: Reports
Al Jazeera English,Indian police officer suspected of aiding Kashmir rebels arrested
Al Jazeera English,Qatar's Emir Sheikh Tamim to visit Iran for talks
Al Jazeera English,Iran admits downing Ukrainian airliner: All the latest updates
Al Jazeera English,"What do tense US-Iranian relations mean for China, North Korea?"
Al Jazeera English,"Philippines on alert as volcano spews ash, steam and lava"
Al Jazeera English,Iran denies 'cover up' amid public anger over plane crash
Al Jazeera English,Judges say special court in Musharraf case was unconstitutional
Al Jazeera English,'Clerics get lost!': Iran protests rage on for a third day
Al Jazeera English,Libyan forces loyal to Haftar announce conditional ceasefire
Al Jazeera English,"Oman's new Sultan faces diplomatic, economic challenges"
Al Jazeera English,World leaders pour into Oman to offer condolences for Qaboos
Al Jazeera English,Rockets fired at Iraq base housing US troops: Reports
Al Jazeera English,What's behind the Qassem Soleimani assassination?
Al Jazeera English,Putin meets Assad in rare Syria visit amid US-Iran tensions
Al Jazeera English,Dozens killed in stampede at Qassem Soleimani's funeral
Al Jazeera English,Iran's Khamenei says missile strike a 'slap in the face' for US
Al Jazeera English,World reacts after Iran fires rockets at US forces in Iraq
Al Jazeera English,Ukrainian airliner crashes near Tehran: Iranian media
Al Jazeera English,"Trump: US continues to look at options, imposing sanctions"
Al Jazeera English,Ukraine does not rule out attack as cause of plane crash in Iran
Al Jazeera English,Prospect of fresh sanctions on Iran rises as EU leaders mull deal
Al Jazeera English,US to send Mexican asylum seekers to Guatemala under new plan
Al Jazeera English,Libya: Haftar forces announce capture of large parts of Sirte
Al Jazeera English,Police fire tear gas as Hong Kong rings in New Year
Al Jazeera English,JNU attack: India police file case against injured student leader
Al Jazeera English,Pentagon rejects Trump threat to target Iranian cultural sites
Al Jazeera English,TOI 700 d: Earth-sized planet found relatively nearby
Al Jazeera English,Soleimani killing: Iran's Zarif vows response to US 'act of war'
Al Jazeera English,India to hang 2012 New Delhi gang rape convicts on January 22
Al Jazeera English,Libya: GNA-aligned forces say they quit Sirte to avoid bloodshed
Al Jazeera English,Senate Republicans back plan for Trump impeachment trial rules
Al Jazeera English,'Farcical exercise': Foreign envoys in Kashmir on India invite
Al Jazeera English,Iran: Ukraine plane caught fire but crew never called for help
Al Jazeera English,UN monitors say Houthis not behind Saudi Aramco attacks: Report
Al Jazeera English,US believes Ukraine plane accidentally brought down by Iran
Al Jazeera English,US House to vote on limiting Trump's actions against Iran
Al Jazeera English,UK Parliament approves Boris Johnson's Brexit deal
Al Jazeera English,Fighting rages in northwest Syria; two Turkish troops killed
Al Jazeera English,Residents of Idlib: 'Your indifference is our death sentence'
Al Jazeera English,Coronavirus in N Korea could be 'much more lethal' than in China
Al Jazeera English,Germany shisha lounge shootings: All the latest updates
Al Jazeera English,California to apologise for internment of Japanese Americans
Al Jazeera English,Analysts see 'blue wave' emerging in US cities ahead of election
Al Jazeera English,"S Sudan president, rebel leader agrees to form unity government"
Al Jazeera English,Will Kagame and Museveni resolve their dispute?
Al Jazeera English,200 days of Kashmir siege: A mother's wait for her jailed son
Al Jazeera English,Apathy runs high in Tehran as Iran gears up for parliament vote
