source,headline
CNN,Trump tweets 'threat' to Iran over protests at Baghdad embassy - CNN Video
CNN,EPA science board criticizes Trump administration's environmental proposals
CNN,Watch protesters use battering ram on US embassy - CNN Video
CNN,US sending additional forces to protect embassy threatened by protesters in Iraq
CNN,Protesters attack US embassy in Baghdad after airstrikes
CNN,Projection shows Florida and North Carolina among states that could gain congressional seats after Census
CNN,Trump signs robo-call bill into law
CNN,Biden would nominate Obama to Supreme Court 'if he'd take it'
CNN,A proxy war between the US and Iran just moved a step closer
CNN,Trump's airstrikes are a sensible use of force
CNN,"In 1988, a US Navy warship shot down an Iranian passenger plane"
CNN,Impeachment impasse shows Pelosi's power
CNN,US-Iran: Latest updates on the plane crash and ongoing conflict - CNN
CNN,Preet Bharara to Georgia congressman: You've hit a shocking new low
CNN,Chris Cuomo: How could Iran have made this fatal mistake with Ukrainian Flight 752? - CNN Video
CNN,Video appears to show Ukrainian airliner being hit - CNN Video
CNN,Newlyweds died together in the plane crash in Iran a week after their wedding
CNN,In photos: Ukrainian plane crashes in Iran
CNN,Trudeau says Canada has intelligence Iran shot down Ukrainian airliner
CNN,US-Iran news: The latest on the crisis - CNN
CNN,CNN reporter presses Pompeo to define 'imminent' - CNN Video
CNN,US imposes sanctions on Iranian steel and other metals
CNN,"Trump furious over House war powers vote, sources say - CNN Video"
CNN,How 'Lock Her Up!' just blew up
CNN,Iran's UN ambassador says missile strikes weren't intended to kill Americans
CNN,Video appears to show missile strike as Canada and UK say they have intel Iran shot down Ukrainian plane
CNN,Iranian official says reports that missiles downed Ukrainian plane 'a big lie'
CNN,US-Iran: Latest updates on the Ukrainian plane crash and ongoing conflict - CNN
CNN,College staffer out of a job over post suggesting Iran list Mall of America and Kardashian home as targets
CNN,Aviation expert breaks down what happens in shocking video  - CNN Video
CNN,"Boeing's biggest supplier lays off 2,800 workers because of 737 Max production suspension"
CNN,US unsuccessfully targeted another Iranian military official on same day as Soleimani
CNN,Trump had a busy week even aside from Iran and impeachment. Here's what you missed.
CNN,How Americans and Iranians are using memes and hashtags to cope with conflict
CNN,US-Iran news: Live updates on the Ukraine plane crash and conflict  - CNN
CNN,Millions of Americans brace for crippling ice and dangerous tornadoes
CNN,North Korea says US 'deceived' Pyongyang on nuclear talks after Trump sends Kim birthday letter
CNN,Iran says Ukrainian passenger plane was shot down unintentionally in fear of US aggression
CNN,New video shows moment airliner crashes in Iran  - CNN Video
CNN,Victims of Iran plane crash hailed from around the world
CNN,First on CNN: Russian warship 'aggressively approached' US destroyer in Arabian Sea
CNN,See the destruction at Iraqi air base targeted by Iran - CNN Video
CNN,Why America needs to hear from its government
CNN,"Erin Burnett: When it comes to Trump, accuracy does not matter - CNN Video"
CNN,Another earthquake hits Puerto Rico
CNN,"Millions of Americans brace for flooding, strong winds and crippling ice"
CNN,Why Trump's changing Iran story is costing him support in Congress
CNN,2 US service members killed in Afghanistan
CNN,Washington Post: Trump angry with ally Matt Gaetz for urging Republicans to vote for Iran war powers resolution
CNN,These Republicans voted yes on the War Powers resolution
CNN,Iranian protesters take to streets after Tehran admits Ukrainian plane was shot down unintentionally in fear of US aggression
CNN,"US troops knew Al-Asad air base would be attacked and sheltered in bunkers, exclusive tour reveals"
CNN,Trump administration's shifting stories fuel doubts over justification for Soleimani strike
CNN,Multi-day severe weather system slams Central and Eastern US - CNN Video
CNN,MIllions in eastern half of US brace for crippling ice and dangerous tornadoes  - CNN Video
CNN,"Storms kill at least 8, with tornadoes, flooding and crippling ice still in the forecast for eastern US"
CNN,The royal family will hold a summit Monday to discuss Prince Harry and Meghan
CNN,Justin Trudeau toughens his stand on the world stage as he demands justice over plane downed by Iran
CNN,weather forecast: US storms bring power outages and tornados to east coast - CNN
CNN,4 tornado safety tips that could save your life
CNN,The US-Iran conflict: A timeline of how we got here
CNN,Trump administration officials have contradicted each other on Soleimani again and again. This is the result.
CNN,Illinois cannabis sales bring in $3.2 million on day one
CNN,Former HBO chief Richard Plepler signs production deal with Apple
CNN,Uyghur gravesites in China wiped off the map - CNN Video
CNN,Rudy Giuliani: 'I would testify' in Senate impeachment trial - CNN Video
CNN,All eyes on McConnell as Senate returns Friday
CNN,"White House budget official told Pentagon that order to hold Ukraine aid came from Trump, national security site reports"
CNN,Hanukkah stabbing victim's family releases photo to show brutality of anti-Semitic attack
CNN,Bill Taylor departs post as top US diplomat in Ukraine
CNN,Ranking the 5 Democrats with the best chance of winning in 2020
CNN,The Trump cover-up is unfolding before our eyes
CNN,Jake Tapper: This email flies in the face of Trump's defenders - CNN Video
CNN,Marianne Williamson lays off campaign staff nationally
CNN,"Ethan Couch, who killed four people in 'affluenza' case, arrested again in Texas"
CNN,A Texas judge says hospital can remove 11-month-old Tinslee Lewis off life support despite her family's wishes
CNN,Trump tweets false claim about homelessness in California - CNN Video
CNN,"Trump warns Iran if it hits any Americans or American assets 'we have targeted 52 Iranian sites"""
CNN,Activists across the US and the world protest a possible war with Iran
CNN,Analyst fact-checks Mike Pence's tweet about Soleimani - CNN Video
CNN,Fox's Tucker Carlson breaks with colleagues and criticizes Trump's strike on Iranian general
CNN,Trump administration warns Congress Iran could retaliate against US 'within weeks'
CNN,US-Iran latest news and live updates - CNN
CNN,Jason Rezaian was an Iranian prisoner for 544 days. What he knows about the regime - CNN Video
CNN,"Alabama woman who texted 'I feel in trouble' before she disappeared has been found dead, police say"
CNN,Retired Major General James Marks tells senator to 'just be quiet' after Iran strike - CNN Video
CNN,Ex-NATO Commander: This tweet was a good move by Trump  - CNN Video
CNN,The future of Iran's nuclear deal looks grim following Soleimani's killing
CNN,"The Irwin family has saved over 90,000 animals injured in the Australia wildfires"
CNN,How Trump's decision unfolded to kill a top Iranian general
CNN,'World War III' was trending
CNN,Exclusive: Supreme Leader's military adviser says Iran's response will be 'against military sites'
CNN,Tom Brady says retirement is 'hopefully unlikely' after Patriots are eliminated from the NFL playoffs
CNN,The sky is blood red over parts of Australia as fires rage
CNN,'Orange Is the New Black' creator Jenji Kohan says her late son was her 'best work'
CNN,Skepticism mounts over evidence of 'imminent' threat that Trump says justified Soleimani killing
CNN,Buttigieg on Soleimani strike: We need answers - CNN Video
CNN,Pompeo backs Trump's threats to Iran as US braces for possible retaliation
CNN,Pennsylvania Turnpike crash kills 5 people and injures 60 others
CNN,How Republican hawks primed Trump to strike back at Iran
CNN,Senior US officials say there is widespread opposition within the Trump administration to targeting cultural sites in Iran
CNN,Iraqi Parliament votes for government to work on plan to end US troop presence in Iraq after Soleimani killing
CNN,US-led coalition pauses fight against ISIS in Iraq
CNN,Trump's America stands utterly alone
CNN,Serious debate preceded Trump's decision to strike Soleimani
CNN,"Iran has online disinformation operations, too"
CNN,Why now? Lawmakers question timing and legality of Trump's strike against Iranian commander
CNN,Trump speaks after ordering strike on top Iran general - CNN Video
CNN,A US Army officer's mom just got deported. He says he feels betrayed
CNN,Trump has created his biggest foreign policy crisis yet
CNN,CNN analyst: All American citizens now walking targets  - CNN Video
CNN,New Ukraine revelations turn up heat on Senate trial showdown
CNN,Iran's top general Soleimani killed: Live updates - CNN
CNN,"An airstrike in Iraq hit a convoy of Iranian-backed paramilitary forces, PMF says"
CNN,Soleimani killing: What happens next?
CNN,There's a fire in Australia the size of Manhattan
CNN,"US killed top Iranian commander to stop a war and not start one, Trump says"
CNN,This is the bombshell Trump's team didn't want revealed
CNN,Iranian ambassador to the United Nations vows 'harsh revenge' in CNN interview - CNN Video
CNN,Selective Service System website crashes amid questions and fears of another US military draft
CNN,Inside Trump's decision to kill a top Iranian military general
CNN,Trump vulnerable to Iranian revenge in US election year
CNN,Trump repeatedly claimed in 2011 and 2012 that Obama would start a war with Iran to win re-election
CNN,US authorities prepare as Iran vows revenge for Soleimani strike
CNN,"United Methodist Church proposes split over gay marriage, LGBT clergy"
CNN,"Former employees talk about dangerous medical care in jails, prisons - CNN Video"
CNN,"Sick and behind bars, they begged for help - CNN Video"
CNN,'Please help me before it's too late'
CNN,Trump says attack by Iran on anything American will be met with 'obliteration'
CNN,US carried out cyberattack on Iranian backed militia
CNN,Acting US Customs and Border Protection Commissioner John Sanders to leave
CNN,GOP rep says migrant children 'are free to leave' facilities 'at any time'
CNN,It looks like any other graduation -- except these graduates earned their degrees in prison
CNN,Van Jones: Our criminal justice system is built to inflict pain. Here's how we can heal it.
CNN,The US still incarcerates more people than any other country
CNN,Are fears about American deaths in the D.R. overblown? - CNN Video
CNN,Ohio serial killer's mother was stabbed to death in the home where her son had been arrested
CNN,"After deaths, more tourists to Dominican Republic say they were stricken with illness"
CNN,Beto O'Rourke proposes 'war tax' as part of veterans' plan
CNN,"A bystander says Cam Newton offered $1,500 to trade seats with another passenger. He was rejected"
CNN,A 10th American has died while vacationing in the Dominican Republic
CNN,Tense exchange from Buttigieg's South Bend town hall - CNN Video
CNN,Hard Rock Hotel in Dominican Republic to remove liquor dispensers from minibars
CNN,"Your questions about the Dominican Republic tourist deaths, answered"
CNN,Couple: We were sickened at same DR hotel where Americans died
CNN,"Under Pete Buttigieg, racial tension has long plagued South Bend's Police Department"
CNN,Former Pennsylvania Democratic Rep. Joe Sestak declares run for president in surprise announcement
CNN,Obama voters explain why they chose Donald Trump in 2016 - CNN Video
CNN,Trump is acting out of character. Here's why
CNN,Avlon: Here's the big warning sign for Trump's reelection - CNN Video
CNN,Trump says he's not ready for a 2020 election loss
CNN,'Barack picked him for a reason': South Carolina voters stand by Joe Biden after comments about segregationist senators
CNN,Beth Chapman from 'Dog the Bounty Hunter' is in a medically-induced coma
CNN,Woman arrested after RAF jets escort passenger plane back to London
CNN,Seismologist explains rolling feeling after California earthquake - CNN Video
CNN,Live updates: Earthquake rattles Southern California - CNN
CNN,Trump faces 'limited paths forward' on census citizenship question
CNN,Miami Dolphins' Kendrick Norton had his arm amputated after a car wreck
CNN,6.4 earthquake rattles Southern California
CNN,Live updates: Trump's July 4th celebration - CNNPolitics
CNN,Bernard Tomic fined for lack of effort
CNN,Are parts of India becoming too hot for humans?
CNN,"More than 400 small earthquakes rattle Southern California, but it's not a big deal, seismologists say"
CNN,The place where two earthquakes hit every hour
CNN,Cooper calls out White House over lack of press briefings - CNN Video
CNN,Here's what White House press secretary Stephanie Grisham has to say about not holding press briefings
CNN,CNN's Jake Tapper: 'Terrorist lover' attacks from Trump defenders are smears - CNN Video
CNN,Former US officials call for the return of press briefings: 'It's about accountability'
CNN,A royal showdown at Sandringham looms over Harry and Meghan's decision to go it alone
CNN,Fact check: Trump made 15 false claims during quiet week in Florida
CNN,"At a crucial moment, lack of trust in a president can be deadly"
CNN,Iranian leaders under pressure at home and abroad as public anger mounts over downed plane
CNN,Trump revives bad memories in new storm over intelligence
CNN,Pelosi defends impeachment pause as White House stands 'prepared' for looming Senate trial
CNN,How to cope with war anxiety over Iran
CNN,"Majority of Americans disapprove of Trump's handling of Iran and feel less safe, poll says"
CNN,'The world is watching': Trump again warns Iran's leaders about protesters
CNN,The crisis between the US and Iran is far from over
CNN,Michael Bloomberg: The primary calendar hurts Democrats and helps Trump
CNN,Canadian CEO says the United States shares blame for Iran plane crash
CNN,Prince Harry and Prince William say bullying story is false
CNN,US troops sheltered in Saddam-era bunkers during Iran missile attack
CNN,Conservative 'Moms' group slams Burger King for using 'the d-word' in a commercial
CNN,What exactly is the Trump administration up to in Iran?
CNN,Stabbing spree in Colorado Springs leaves 8 injured
CNN,Iran's sole female Olympic medalist says she's defected
CNN,"At least 9 people have died in storms across the country this weekend that brought flooding, tornadoes and icy conditions"
CNN,What motivated Iran to come clean
CNN,Cracks emerge in Trump's wall of GOP support
CNN,Animals badly burnt by Australian wildfires euthanized - CNN Video
CNN,See the Australian fires from the sky  - CNN Video
CNN,Australian Prime Minister admits mistakes in bushfire crisis amid mounting criticism
CNN,"Australia's indigenous people have a solution for the country's bushfires. And it's been around for 50,000 years"
CNN,In photos: Australia bushfires
CNN,Australia is burning. The Arctic is melting. Yet Trump keeps gutting climate change regulations.
CNN,Madame Tussauds removes Meghan and Harry waxworks - CNN Video
CNN,Here's what Meghan and Harry's financial future could look like - CNN Video
CNN,"Coming or going, Meghan gets the blame -- and it's because of her race"
CNN,Oprah denies advising Prince Harry and Meghan
CNN,Harry defied the Queen over statement on royal role
CNN,Rockets hit airbase in Iraq where US troops are located
CNN,The evolving US justification for killing Iran's top general
CNN,Dozens killed in stampede at funeral of slain Iranian commander
CNN,This is what a war between the United States and Iran could look like - CNN Video
CNN,The last White House press briefing was 301 days ago - CNN Video
CNN,President Trump on striking Iran cultural sites: I like to obey the law - CNN Video
CNN,Fact check: Amy Klobuchar falsely claims Iran is 'announcing' it will develop a nuclear weapon
CNN,"Top Facebook exec: Yes, we got Trump elected and it may happen again"
CNN,"US forces on high alert for possible Iranian drone attacks, and intelligence shows Iran moving military equipment"
CNN,US-Iran news today: Live updates after Qasem Soleimani's death - CNN
CNN,Video appears to show missiles hit airbase housing US troops - CNN Video
CNN,Oil prices soar after Iran attacks airbases housing US troops in Iraq
CNN,The price of Trumpian chaos
CNN,Dow futures tumble 300 points after 10 rockets hit airbase in Iraq
CNN,US-Iran news today: Rockets hit Iraq base where US troops are located - CNN
CNN,The US spent trillions trying to remake the Middle East. Trump's strike may have undone it all
CNN,Iran's strikes seem intended to avoid US deaths. Here's why that might be the case
CNN,What you need to know about the military bases targeted by Iranian missiles
CNN,Iran attacks Iraqi bases housing US troops in retaliation for Soleimani's death
CNN,The most significant weapons in the US arsenal
CNN,Sen. Lindsey Graham has warning for Iranians following missile strike - CNN Video
CNN,Iran defies Trump's wrath with retaliatory missile attacks
CNN,Iran plane crash with 180 on board: Live updates - CNN
CNN,Donald Trump tweets message of optimism following Iran's missile attacks - CNN Video
CNN,Some administration officials believe Iran intentionally missed areas with Americans
CNN,This is what Iranian Americans think will happen next
CNN,US-Iran news: Iran fires missiles at US forces in Iraq - CNN
CNN,Iran's supreme leader: US got slap in the face - CNN Video
CNN,Trump to address nation after Iran attacks Iraqi bases housing US troops in retaliation for Soleimani's death
CNN,Boeing faces more trouble after crash of a Ukrainian 737 jet in Iran
CNN,Iran plane crash: Ukrainian plane crashes in Tehran - Live updates - CNN
CNN,Donald Trump takes the off-ramp in Iran confrontation (for now)
CNN,Donald Trump announces additional sanctions on Iran - CNN Video
CNN,US Army warns about fake text messages about military draft
CNN,"1 dead, 3 injured as police search for suspect in Ottawa shooting"
CNN,Trump to address nation after Iran's retaliatory attacks against Iraqi bases housing US troops
CNN,Live updates: Iran attacks bases housing US troops - CNN
CNN,Iran could use this drone for attacks - CNN Video
CNN,Video appears to show missiles hit air base housing US troops - CNN Video
CNN,How Ruth Bader Ginsburg is trying to check the conservative majority
CNN,Harry and Meghan to step back from 'senior' roles in royal family
CNN,Satellite images appear to show damage from Iranian missile strikes at Iraqi base
CNN,Two rockets land in Baghdad's heavily fortified Green Zone
CNN,Former DNI James Clapper on Iran: There's been too much 'chest-beating' - CNN Video
CNN,House slates Iran War Powers resolution vote for Thursday
CNN,Iran sent 'multiple messages' to US that its attacks were done
CNN,Joe Walsh: Trump is absolutely incompetent and unfit - CNN Video
CNN,Top general say letter suggesting US would withdraw troops from Iraq was a 'mistake'
CNN,Here's the US military footprint in the Middle East - CNN Video
CNN,Fox News host Tucker Carlson questions US strike against Iran - CNN Video
CNN,Was the US killing of Qasem Soleimani legal?
CNN,"Kids, aged 12 and 13, shot by driver after throwing snowballs at passing cars"
CNN,Harvey Weinstein hit with new sexual assault and rape charges out of Los Angeles
CNN,How John Bolton just put the squeeze on Mitch McConnell over impeachment
CNN,"China pneumonia outbreak: It's not SARS, so what is it?"
CNN,One of America's oldest and largest milk producers files for bankruptcy
CNN,US-Iran crisis: Latest news and live updates after General Soleimani's death - CNN
CNN,How Chief Justice John Roberts may impact impeachment trial - CNN Video
CNN,Chief Justice John Roberts says Americans may 'take democracy for granted'
CNN,READ: Chief Justice John Roberts' year-end message
CNN,Democracy has taken a detour this century. Can it get back on track?
CNN,Pompeo tells McConnell he won't run for the Senate
CNN,Pentagon identifies soldier killed in terror attack in Kenya
CNN,Esper contradicts Trump on targeting Iran's cultural sites
CNN,Watch how Pompeo and Conway tried to defend Trump's threat - CNN Video
CNN,Photos of Jeffrey Epstein's cell and a noose made out of a bedsheet published by '60 Minutes'
CNN,Two words that could tip the debate on Iran and help decide 2020 election
CNN,The Met calls striking cultural sites 'abhorrent'
CNN,Iranian foreign minister accuses US of 'state terrorism'
CNN,A lesson for Kim Jong Un in the death of Qasem Soleimani
CNN,"The return of the ""madman"" theory of international relations"
CNN,Iran and impeachment stir huge clash on Capitol Hill
CNN,John Bolton's statement should scare Trump
CNN,Rand Paul: Death of Soleimani is death of diplomacy with Iran - CNN Video
CNN,CNNgo - CNN.com
CNN,GOP congressman shares fake image of Obama with Iranian president
CNN,New pressures greet Pelosi following Bolton's willingness to testify
CNN,US-Iran crisis: Dozens killed in stampede at Qasem Soleimani's funeral - live updates - CNN
CNN,Reporter challenges Mike Pompeo on targeting Iranian cultural sites - CNN Video
CNN,Mike Pompeo: Iran will not get a nuclear weapon - CNN Video
CNN,John Avlon: Why Trump doesn't want you to see these emails - CNN Video
CNN,Pompeo again declines to present evidence of 'imminent' threat that led to strike against Iranian general
CNN,Cupp: Trump is dying for his impeachment trial to begin - CNN Video
CNN,He voted for Obama and Trump. Here's where he's at today - CNN Video
CNN,Inside the new fight to get Trump administration Ukraine documents
CNN,McConnell appears to have the votes to set impeachment trial rules without Democratic support
CNN,Trump impeachment: Live updates - CNNPolitics
CNN,John Bolton still wants to talk -- here's why it matters
CNN,White House skewered for failing to disclose meeting Trump had with Saudi deputy defense minister
CNN,Bernie Sanders could actually win this thing
CNN,See the site of an Iranian missile strike in Iraq  - CNN Video
CNN,Ukrainian plane changed directions before it crashed in Iran
CNN,US-Iran news: Live updates following missile attack in Iraq - CNN
CNN,"Woman had a premonition her plane would crash in Iran, her husband says"
CNN,Trump vs. Iran: It's not over
CNN,GOP rebellion breaks out on Iran as Senate inches toward impeachment
CNN,Live updates: Iran plane crash investigation - CNN
CNN,Standing down: How Trump decided that not striking back was his best option on Iran
CNN,Trump needs the 'deep state' more than ever
CNN,Sen. Lee on Iran briefing: Worst briefing I've seen on a military issue - CNN Video
CNN,"Ukraine investigators consider missile strike, terrorism as possible causes of Iran plane crash"
CNN,Trump's head-spinning gyrations on Iran are confusing everyone
CNN,Ukraine deletes message after plane crash in Iran - CNN Video
CNN,See wreckage of the Ukraine International Airlines Boeing plane crash in Iran - CNN Video
CNN,US increasingly believes Iran shot down Ukrainian airliner by accident
CNN,Body of stowaway found in Air France plane's landing gear
CNN,Live updates: Trump impeachment news - CNNPolitics
CNN,Plane crash in Iran: Live updates on the investigation - CNN
CNN,Iran plane crash: A pilot's perspective
CNN,Video appears to show missile hit object in sky - CNN Video
CNN,Goldman Sachs warns of stock market correction
CNN,Prayer leader stabbed at London mosque as police arrest man on suspicion of attempted murder
CNN,Germany shooting: Gunman kills 9 at Hanau shisha bars
CNN,Los Angeles Times is offering buyouts to staffers with at least two years of employment
CNN,Top NSC official reassigned as White House rejects rumors she wrote 'Anonymous'
CNN,Mysterious '1' notification spooks Samsung Galaxy owners
CNN,"An ex-boyfriend was charged with killing Amie Harwick by throwing her over a balcony, DA says"
CNN,Roger Stone sentenced to 40 months in prison
CNN,Two Japan cruise ship passengers die from coronavirus
CNN,What drives Amy Klobuchar's disdain for Pete Buttigieg
